book_id,processed_dir,title,genre_primary,chunk_index,pc,direction,score,text_preview
1184,count_monte_cristo,The Count of Monte Cristo,Adventure,331,PC1,positive,0.5262280106544495,"shore of the Mediterranean. If Bonaparte landed at Naples, the whole coalition would be on foot before he could even reach Piombino; if he land in Tuscany, he will be in an unfriendly territory; if he land in France, it "
1184,count_monte_cristo,The Count of Monte Cristo,Adventure,1850,PC1,positive,0.5238817930221558,"my honor,’ replied M. de Villefort; ‘they fancy that their countryman is still emperor. You have mistaken the time, you should have told me this two months ago, it is too late now. Go now, at once, or I shall have you pu"
1257,three_musketeers,The Three Musketeers,Adventure,317,PC1,positive,0.5154047608375549,"Luxembourg to the Place St. Sulpice, or from the Rue du Vieux-Colombier to the Luxembourg. In the meanwhile the promises of M. de Tréville went on prosperously. One fine morning the king commanded M. de Chevalier Dessess"
1257,three_musketeers,The Three Musketeers,Adventure,577,PC1,positive,0.4987051486968994,"“police affairs! And what do you know about them, Monsieur? Meddle with your Musketeers, and do not annoy me in this way. It appears, according to your account, that if by mischance a Musketeer is arrested, France is in "
1184,count_monte_cristo,The Count of Monte Cristo,Adventure,388,PC1,positive,0.49865084886550903,"was all powerful at court, and thus the Girondin of ’93 and the Senator of 1806 protected him who so lately had been his protector. All Villefort’s influence barely enabled him to stifle the secret Dantès had so nearly d"
1257,three_musketeers,The Three Musketeers,Adventure,559,PC1,positive,0.4844011068344116,"not have the time necessary, from this moment declared that his name was Athos, and not D’Artagnan. He added that he did not know either M. or Mme. Bonacieux; that he had never spoken to the one or the other; that he had"
175,phantom_opera,The Phantom of the Opera,Gothic,554,PC1,positive,0.36311841011047363,"has really carried Christine Daae off or not ... but I want to know and I believe that, at this moment, no one is more anxious to inform us than his brother ... And now he is flying in pursuit of him! He is my chief auxi"
175,phantom_opera,The Phantom of the Opera,Gothic,814,PC1,positive,0.3566727936267853,"he saw that he was being victimized by a shrewd blackmailer to whom Debienne himself had fallen a prey. Both of them, already tired of management for various reasons, went away without trying to investigate further into "
175,phantom_opera,The Phantom of the Opera,Gothic,783,PC1,positive,0.35260507464408875,"not hear him. Erik returned, mixed the daroga a draft and advised him not to speak to ""his wife"" again nor to any one, BECAUSE IT MIGHT BE VERY DANGEROUS TO EVERYBODY'S HEALTH. Eventually, the Persian fell asleep, like M"
521,robinson_crusoe,Robinson Crusoe,Adventure,970,PC1,positive,0.2978517413139343,"barque large enough to carry us all away, either to the Brazils southward, or to the islands or Spanish coast northward; but that if, in requital, they should, when I had put weapons into their hands, carry me by force a"
1661,adventures_sherlock_holmes,The Adventures of Sherlock Holmes,Mystery,861,PC1,positive,0.265868604183197,"me that the money should be paid at once.’ “‘I should be happy to advance it without further parley from my own private purse,’ said I, ‘were it not that the strain would be rather more than it could bear. If, on the oth"
521,robinson_crusoe,Robinson Crusoe,Adventure,1137,PC1,positive,0.26304805278778076,"give answers suitable to the just and faithful account of things I had from thence; and, first, to the Prior of St. Augustine I wrote a letter full of thanks for his just dealings, and the offer of the eight hundred and "
521,robinson_crusoe,Robinson Crusoe,Adventure,124,PC1,positive,0.25851234793663025,"take away that life I have given. No, no,” says he: “Seignior Inglese” (Mr. Englishman), “I will carry you thither in charity, and those things will help to buy your subsistence there, and your passage home again.” As he"
345,dracula,Dracula,Horror,175,PC1,positive,0.25447535514831543,"* * * * _19 May._--I am surely in the toils. Last night the Count asked me in the suavest tones to write three letters, one saying that my work here was nearly done, and that I should start for home within a few days, an"
345,dracula,Dracula,Horror,1418,PC1,positive,0.2531032860279083,"we are to see the Vice-Consul, and to arrange, if we can, about getting on board the ship as soon as she arrives. Van Helsing says that our chance will be to get on the boat between sunrise and sunset. The Count, even if"
16,peter_pan,Peter Pan,Fantasy,26,PC1,negative,-0.44747158885002136,"up.” “Were not the leaves at the foot of the window, mother?” It was quite true; the leaves had been found very near the window. Mrs. Darling did not know what to think, for it all seemed so natural to Wendy that you cou"
16,peter_pan,Peter Pan,Fantasy,194,PC1,negative,-0.4324108958244324,"or the only available tree is an odd shape, Peter does some things to you, and after that you fit. Once you fit, great care must be taken to go on fitting, and this, as Wendy was to discover to her delight, keeps a whole"
55,wonderful_wizard_oz,The Wonderful Wizard of Oz,Fantasy,70,PC1,negative,-0.4255940318107605,"face clean after the dust of the road, and to drink, so the dry bread will not stick in my throat.” “It must be inconvenient to be made of flesh,” said the Scarecrow thoughtfully, “for you must sleep, and eat and drink. "
113,secret_garden,The Secret Garden,Children's Fiction,124,PC1,negative,-0.419877827167511,"wings and made a darting flight to the top of a tree, where he perched and sang loudly. That reminded Mary of the first time she had seen him. He had been swinging on a tree-top then and she had been standing in the orch"
16,peter_pan,Peter Pan,Fantasy,163,PC1,negative,-0.4191574454307556,"after Hook. Once more the boys emerged into the open; but the dangers of the night were not yet over, for presently Nibs rushed breathless into their midst, pursued by a pack of wolves. The tongues of the pursuers were h"
113,secret_garden,The Secret Garden,Children's Fiction,210,PC1,negative,-0.40848636627197266,left all by themselves so long; and indeed it was different from any other place she had ever seen in her life. “How still it is!” she whispered. “How still!” Then she waited a moment and listened at the stillness. The r
768,wuthering_heights,Wuthering Heights,Gothic,651,PC1,negative,-0.40247875452041626,"to his teaching. Till she reached the age of thirteen she had not once been beyond the range of the park by herself. Mr. Linton would take her with him a mile or so outside, on rare occasions; but he trusted her to no on"
113,secret_garden,The Secret Garden,Children's Fiction,170,PC1,negative,-0.3994019031524658,"it, trying to imagine what it would be like to lie down on one of the little snow-white clouds and float about. She went into the first kitchen-garden and found Ben Weatherstaff working there with two other gardeners. Th"
55,wonderful_wizard_oz,The Wonderful Wizard of Oz,Fantasy,222,PC1,negative,-0.39543402194976807,"rage, and blew three times upon her silver whistle. Forthwith there was heard a great buzzing in the air, and a swarm of black bees came flying toward her. “Go to the strangers and sting them to death!” commanded the Wit"
55,wonderful_wizard_oz,The Wonderful Wizard of Oz,Fantasy,345,PC1,negative,-0.3916759490966797,"to a thick wood. There was no way of going around it, for it seemed to extend to the right and left as far as they could see; and, besides, they did not dare change the direction of their journey for fear of getting lost"
768,wuthering_heights,Wuthering Heights,Gothic,364,PC1,negative,-0.3851974606513977,"principles, and still less sympathy for her feelings. I wanted something to happen which might have the effect of freeing both Wuthering Heights and the Grange of Mr. Heathcliff, quietly; leaving us as we had been prior "
768,wuthering_heights,Wuthering Heights,Gothic,428,PC1,negative,-0.3839545249938965,"once among the heather on those hills. Open the window again wide: fasten it open! Quick, why don’t you move?” “Because I won’t give you your death of cold,” I answered. “You won’t give me a chance of life, you mean,” sh"
11,alice_s_adventures_wonderland,Alice's Adventures in Wonderland,Fantasy,9,PC1,negative,-0.3787720203399658,"mice in the air, I’m afraid, but you might catch a bat, and that’s very like a mouse, you know. But do cats eat bats, I wonder?” And here Alice began to get rather sleepy, and went on saying to herself, in a dreamy sort "
11,alice_s_adventures_wonderland,Alice's Adventures in Wonderland,Fantasy,98,PC1,negative,-0.3677822947502136,"it as far as they would go, and broke off a bit of the edge with each hand. “And now which is which?” she said to herself, and nibbled a little of the right-hand bit to try the effect: the next moment she felt a violent "
1260,jane_eyre,Jane Eyre,Gothic,52,PC1,negative,-0.36669832468032837,"of some coming vision from another world. My heart beat thick, my head grew hot; a sound filled my ears, which I deemed the rushing of wings; something seemed near me; I was oppressed, suffocated: endurance broke down; I"
1342,pride_prejudice,Pride and Prejudice,Romance,475,PC2,positive,0.5126047730445862,"I go on I shall displease you by saying what I think of persons you esteem. Stop me, whilst you can.” “You persist, then, in supposing his sisters influence him?” “Yes, in conjunction with his friend.” “I cannot believe "
1342,pride_prejudice,Pride and Prejudice,Romance,352,PC2,positive,0.5058188438415527,"and whose astonishment at being so addressed was very evident. Her cousin prefaced his speech with a solemn bow, and though she could not hear a word of it, she felt as if hearing it all, and saw in the motion of his lip"
1342,pride_prejudice,Pride and Prejudice,Romance,423,PC2,positive,0.49198639392852783,"love in Mr. Darcy for herself, she would have ordered her wedding clothes. But the case is this:--we are not rich enough or grand enough for them; and she is the more anxious to get Miss Darcy for her brother, from the n"
1513,romeo_juliet,Romeo and Juliet,Tragedy,38,PC2,positive,0.4346567988395691,"I have done. God mark thee to his grace Thou wast the prettiest babe that e’er I nurs’d: And I might live to see thee married once, I have my wish. LADY CAPULET. Marry, that marry is the very theme I came to talk of. Tel"
1513,romeo_juliet,Romeo and Juliet,Tragedy,182,PC2,positive,0.41289955377578735,"to rate her so. CAPULET. And why, my lady wisdom? Hold your tongue, Good prudence; smatter with your gossips, go. NURSE. I speak no treason. CAPULET. O God ye good-en! NURSE. May not one speak? CAPULET. Peace, you mumbli"
1260,jane_eyre,Jane Eyre,Gothic,1046,PC2,positive,0.4014192223548889,"them.” “I will myself put the diamond chain round your neck, and the circlet on your forehead,—which it will become: for nature, at least, has stamped her patent of nobility on this brow, Jane; and I will clasp the brace"
768,wuthering_heights,Wuthering Heights,Gothic,511,PC2,positive,0.39776402711868286,"as fond of each other as any two people can be,” cried Isabella, with sudden vivacity. “No one has a right to talk in that manner, and I won’t hear my brother depreciated in silence!” “Your brother is wondrous fond of yo"
1260,jane_eyre,Jane Eyre,Gothic,1030,PC2,positive,0.394412636756897,"was coldness both from her and her mother. I would not—I could not—marry Miss Ingram. You—you strange, you almost unearthly thing!—I love as my own flesh. You—poor and obscure, and small and plain as you are—I entreat to"
768,wuthering_heights,Wuthering Heights,Gothic,875,PC2,positive,0.39082270860671997,"morning, Catherine learnt my betrayal of her confidence, and she learnt also that her secret visits were to end. In vain she wept and writhed against the interdict, and implored her father to have pity on Linton: all she"
1513,romeo_juliet,Romeo and Juliet,Tragedy,201,PC2,positive,0.38124167919158936,"tell him of this. I’ll have this knot knit up tomorrow morning. JULIET. I met the youthful lord at Lawrence’ cell, And gave him what becomed love I might, Not stepping o’er the bounds of modesty. CAPULET. Why, I am glad "
1184,count_monte_cristo,The Count of Monte Cristo,Adventure,2206,PC2,positive,0.38100355863571167,"could lavish the tenderness some fathers do on their daughters. What though she has lost her own mother at a tender age, she has had the happiness to find a second mother in Madame de Villefort.’ The world, however, is m"
1260,jane_eyre,Jane Eyre,Gothic,1584,PC2,positive,0.3791269063949585,"love; and I will not be regarded in the light of a mere money speculation. And I do not want a stranger—unsympathising, alien, different from me; I want my kindred: those with whom I have full fellow-feeling. Say again y"
768,wuthering_heights,Wuthering Heights,Gothic,815,PC2,positive,0.37561243772506714,"called me a pitiful, shuffling, worthless thing; and said you despised me; and if he had been in my place, he would be more the master of the Grange than your father by this time. But you don’t despise me, do you, Miss—?"
1184,count_monte_cristo,The Count of Monte Cristo,Adventure,3102,PC2,positive,0.35784637928009033,"but because she will marry, a union with any other would have caused him the same sorrow. Old age is selfish, sir, and Mademoiselle de Villefort has been a faithful companion to M. Noirtier, which she cannot be when she "
84,frankenstein_modern_prometheus,"Frankenstein; Or, The Modern Prometheus",Sci-Fi,484,PC2,positive,0.35367172956466675,"returning to yourself. And yet you are still unhappy and still avoid our society. For some time I was lost in conjecture as to the cause of this, but yesterday an idea struck me, and if it is well founded, I conjure you "
36,war_worlds,The War of the Worlds,Sci-Fi,30,PC2,negative,-0.5518261194229126,"the end. It was dropping off in flakes and raining down upon the sand. A large piece suddenly came off and fell with a sharp noise that brought his heart into his mouth. For a minute he scarcely realised what this meant,"
521,robinson_crusoe,Robinson Crusoe,Adventure,228,PC2,negative,-0.5419543981552124,"a W. and by S. sun, or thereabouts, which, in those countries, is near the setting. Before I set up my tent I drew a half-circle before the hollow place, which took in about ten yards in its semi-diameter from the rock, "
36,war_worlds,The War of the Worlds,Sci-Fi,139,PC2,negative,-0.519238293170929,"about its strange body. It picked its road as it went striding along, and the brazen hood that surmounted it moved to and fro with the inevitable suggestion of a head looking about. Behind the main body was a huge mass o"
36,war_worlds,The War of the Worlds,Sci-Fi,50,PC2,negative,-0.49263715744018555,"pushed him in. The end of the cylinder was being screwed out from within. Nearly two feet of shining screw projected. Somebody blundered against me, and I narrowly missed being pitched onto the top of the screw. I turned"
521,robinson_crusoe,Robinson Crusoe,Adventure,259,PC2,negative,-0.49111270904541016,"to see if I could spy a ship—I say, giving over these things, I began to apply myself to arrange my way of living, and to make things as easy to me as I could. I have already described my habitation, which was a tent und"
84,frankenstein_modern_prometheus,"Frankenstein; Or, The Modern Prometheus",Sci-Fi,684,PC2,negative,-0.4797740578651428,"difficulty of my labours. One inscription that he left was in these words: “Prepare! Your toils only begin; wrap yourself in furs and provide food, for we shall soon enter upon a journey where your sufferings will satisf"
521,robinson_crusoe,Robinson Crusoe,Adventure,497,PC2,negative,-0.47828274965286255,"and by the dint of hard labour, till I had brought it to be a very handsome periagua, and big enough to have carried six-and-twenty men, and consequently big enough to have carried me and all my cargo. When I had gone th"
1184,count_monte_cristo,The Count of Monte Cristo,Adventure,823,PC2,negative,-0.47242146730422974,"for this purpose. With the aid of his pickaxe, Dantès, after the manner of a labor-saving pioneer, dug a mine between the upper rock and the one that supported it, filled it with powder, then made a match by rolling his "
35,time_machine,The Time Machine,Sci-Fi,184,PC2,negative,-0.47203367948532104,"while I turned this over in my mind I continued to descend. At last, with intense relief, I saw dimly coming up, a foot to the right of me, a slender loophole in the wall. Swinging myself in, I found it was the aperture "
84,frankenstein_modern_prometheus,"Frankenstein; Or, The Modern Prometheus",Sci-Fi,559,PC2,negative,-0.4688990116119385,"encounter with my fellow creatures. At one time the moon, which had before been clear, was suddenly overspread by a thick cloud, and I took advantage of the moment of darkness and cast my basket into the sea; I listened "
84,frankenstein_modern_prometheus,"Frankenstein; Or, The Modern Prometheus",Sci-Fi,30,PC2,negative,-0.46726638078689575,"seemed to have no end. Some of my comrades groaned, and my own mind began to grow watchful with anxious thoughts, when a strange sight suddenly attracted our attention and diverted our solicitude from our own situation. "
35,time_machine,The Time Machine,Sci-Fi,157,PC2,negative,-0.4556809067726135,I clenched my hands and steadfastly looked into the glaring eyeballs. I was afraid to turn. Then the thought of the absolute security in which humanity appeared to be living came to my mind. And then I remembered that st
345,dracula,Dracula,Horror,366,PC2,negative,-0.45294034481048584,"from a gun--a raging madman, with his eyes rolling and his face convulsed with fear. “Save me! save me!” he cried, and then looked round on the blanket of fog. His horror turned to despair, and in a steady voice he said:"
35,time_machine,The Time Machine,Sci-Fi,288,PC2,negative,-0.4523281455039978,"remembered my former headlong fall, I began to reverse my motion. Slower and slower went the circling hands until the thousands one seemed motionless and the daily one was no longer a mere mist upon its scale. Still slow"
1184,count_monte_cristo,The Count of Monte Cristo,Adventure,4507,PC2,negative,-0.4485846161842346,"he found himself between a hillock and a clump of high weeds; three men, standing silent, formed a triangle, of which he was the centre. He wished to speak, but his tongue refused to move. “_Avanti!_” said the same sharp"
1661,adventures_sherlock_holmes,The Adventures of Sherlock Holmes,Mystery,411,PC3,positive,0.4815501868724823,"“S. H. for J. O.” Then he sealed it and addressed it to “Captain James Calhoun, Barque _Lone Star_, Savannah, Georgia.” “That will await him when he enters port,” said he, chuckling. “It may give him a sleepless night. H"
103,around_world_eighty_days,Around the World in Eighty Days,Adventure,579,PC3,positive,0.45230183005332947,"captain forgot in an instant his anger, his imprisonment, and all his grudges against his passenger. The “Henrietta” was twenty years old; it was a great bargain. The bomb would not go off after all. Mr. Fogg had taken a"
103,around_world_eighty_days,Around the World in Eighty Days,Adventure,102,PC3,positive,0.446899950504303,"repaired to the telegraph office, whence he sent the dispatch which we have seen to the London police office. A quarter of an hour later found Fix, with a small bag in his hand, proceeding on board the “Mongolia;” and, e"
103,around_world_eighty_days,Around the World in Eighty Days,Adventure,408,PC3,positive,0.44531702995300293,"made him miss the Yokohama steamer.” Passepartout listened, with closed fists. “Now,” resumed Fix, “Mr. Fogg seems to be going back to England. Well, I will follow him there. But hereafter I will do as much to keep obsta"
36,war_worlds,The War of the Worlds,Sci-Fi,348,PC3,positive,0.4427622854709625,"of her sister-in-law, gave way to panic. She had never been out of England before, she would rather die than trust herself friendless in a foreign country, and so forth. She seemed, poor woman, to imagine that the French"
120,treasure_island,Treasure Island,Adventure,131,PC3,positive,0.44135481119155884,"best ship, sir, and the choicest crew in England. Hawkins shall come as cabin-boy. You’ll make a famous cabin-boy, Hawkins. You, Livesey, are ship’s doctor; I am admiral. We’ll take Redruth, Joyce, and Hunter. We’ll have"
120,treasure_island,Treasure Island,Adventure,348,PC3,positive,0.4264615774154663,"were the first to come forward. Well armed, they stole out of the stockade, but it proved a useless mission. The mutineers were bolder than we fancied or they put more trust in Israel’s gunnery. For four or five of them "
120,treasure_island,Treasure Island,Adventure,218,PC3,positive,0.42258116602897644,"help us to get it aboard, by the powers. Then we’ll see. If I was sure of you all, sons of double Dutchmen, I’d have Cap’n Smollett navigate us half-way back again before I struck.” “Why, we’re all seamen aboard here, I "
1661,adventures_sherlock_holmes,The Adventures of Sherlock Holmes,Mystery,753,PC3,positive,0.4203694760799408,what you advise.” We both sat in silence for some little time after listening to this extraordinary narrative. Then Sherlock Holmes pulled down from the shelf one of the ponderous commonplace books in which he placed his
1342,pride_prejudice,Pride and Prejudice,Romance,1025,PC3,positive,0.40887564420700073,"than their virtue, she could easily conjecture. Mr. Gardiner soon wrote again to his brother. To Mr. Bennet’s acknowledgments he briefly replied, with assurances of his eagerness to promote the welfare of any of his fami"
521,robinson_crusoe,Robinson Crusoe,Adventure,57,PC3,positive,0.4024644196033478,"no expense; I should be his messmate and his companion; and if I could carry anything with me, I should have all the advantage of it that the trade would admit; and perhaps I might meet with some encouragement. I embrace"
1257,three_musketeers,The Three Musketeers,Adventure,1742,PC3,positive,0.3999415636062622,"this man, and hesitated. “Who are you, sir,” asked she, “who has the kindness to trouble yourself so particularly on my account?” “You may perceive, madame, by my uniform, that I am an officer in the English navy,” repli"
345,dracula,Dracula,Horror,663,PC3,positive,0.39799514412879944,"However, I set it all right; and he is going on well. “The two carriers were at first loud in their threats of actions for damages, and promised to rain all the penalties of the law on us. Their threats were, however, mi"
1184,count_monte_cristo,The Count of Monte Cristo,Adventure,560,PC3,positive,0.39618760347366333,"such was the case. I was generally liked on board, and had the sailors possessed the right of selecting a captain themselves, I feel convinced their choice would have fallen on me. There was only one person among the cre"
345,dracula,Dracula,Horror,132,PC3,positive,0.38824939727783203,"my motive was that no local interest might be served save my wish only; and as one of London residence might, perhaps, have some purpose of himself or friend to serve, I went thus afield to seek my agent, whose labours s"
84,frankenstein_modern_prometheus,"Frankenstein; Or, The Modern Prometheus",Sci-Fi,152,PC3,negative,-0.41012778878211975,"of my dead mother in my arms; a shroud enveloped her form, and I saw the grave-worms crawling in the folds of the flannel. I started from my sleep with horror; a cold dew covered my forehead, my teeth chattered, and ever"
345,dracula,Dracula,Horror,1316,PC3,negative,-0.40925055742263794,"he may baffle us for years; and in the meantime!--the thought is too horrible, I dare not think of it even now. This I know: that if ever there was a woman who was all perfection, that one is my poor wronged darling. I l"
345,dracula,Dracula,Horror,997,PC3,negative,-0.4011373221874237,"the first I was sceptic. Were it not that through long years I have train myself to keep an open mind, I could not have believe until such time as that fact thunder on my ear. ‘See! see! I prove; I prove.’ Alas! Had I kn"
345,dracula,Dracula,Horror,1259,PC3,negative,-0.39904990792274475,"and of His children that He has placed thereon. And oh, Madam Mina, my dear, my dear, may we who love you be there to see, when that red scar, the sign of God’s knowledge of what has been, shall pass away, and leave your"
84,frankenstein_modern_prometheus,"Frankenstein; Or, The Modern Prometheus",Sci-Fi,429,PC3,negative,-0.3984055817127228,"ground and struck me violently with a stick. I could have torn him limb from limb, as the lion rends the antelope. But my heart sank within me as with bitter sickness, and I refrained. I saw him on the point of repeating"
1184,count_monte_cristo,The Count of Monte Cristo,Adventure,448,PC3,negative,-0.39378049969673157,"pass before the eye glowing with celestial colors in Martin’s Babylonian pictures. He could not do this, he whose past life was so short, whose present so melancholy, and his future so doubtful. Nineteen years of light t"
175,phantom_opera,The Phantom of the Opera,Gothic,372,PC3,negative,-0.3936096131801605,"and was nearly running into the house, to look for the voice among the killed and wounded, when I thought that, if the voice was safe, it would be sure to be in my dressing-room and I rushed to my room. The voice was not"
